{
  "phase": "build",
  "artifact": "tests",
  "version": "4.0",
  "modules": [
    "mod-001-profile-storage.json",
    "mod-002-profile-writer.json",
    "mod-003-codebase-scanner.json",
    "mod-004-mode-detector.json",
    "mod-005-conflict-detector.json",
    "mod-006-discover-feature-mode.json",
    "mod-007-spec-feature-mode.json",
    "mod-008-build-feature-mode.json"
  ],
  "coverage_summary": {
    "requirements_covered": [
      "REQ-001", "REQ-002", "REQ-003", "REQ-004", "REQ-005",
      "REQ-006", "REQ-007", "REQ-008", "REQ-009", "REQ-010",
      "REQ-011", "REQ-012", "REQ-013", "REQ-014", "REQ-015"
    ],
    "requirements_uncovered": [],
    "invariants_covered": ["INV-001", "INV-002", "INV-003", "INV-004", "INV-005"],
    "invariants_uncovered": [],
    "state_transitions_covered": [
      "MOD-004: detecting → resolved (pure_greenfield)",
      "MOD-004: detecting → onboarding (first_time)",
      "MOD-004: detecting → awaiting_user_choice (returning)",
      "MOD-004: onboarding → awaiting_user_choice",
      "MOD-004: awaiting_user_choice → resolved"
    ],
    "illegal_transitions_tested": [
      "MOD-004: resolved → detecting (cannot go back)",
      "MOD-004: resolved → onboarding (cannot re-onboard after resolution)"
    ]
  },
  "coverage_guards": {
    "invariants_uncovered_must_be_empty": true,
    "requirements_uncovered_must_be_empty": true
  }
}
