{
  "phase": "build",
  "artifact": "tests",
  "version": "4.0",
  "modules": [
    "mod-001-template-engine.json",
    "mod-002-platform-registry.json",
    "mod-003-skill-installer.json",
    "mod-004-legacy-migrator.json",
    "mod-005-skill-structure.json",
    "mod-006-diff-validator.json"
  ],
  "coverage_summary": {
    "requirements_covered": ["REQ-001", "REQ-002", "REQ-003", "REQ-004", "REQ-005", "REQ-006", "REQ-007", "REQ-008", "REQ-009", "REQ-010"],
    "requirements_uncovered": [],
    "invariants_covered": ["INV-001", "INV-002", "INV-003", "INV-004", "INV-005", "INV-006"],
    "invariants_uncovered": []
  },
  "coverage_guards": {
    "invariants_uncovered_must_be_empty": true,
    "requirements_uncovered_must_be_empty": true
  }
}
